{
  "$schema": "https://json-schema.org/draft/2020-12/schema",
  "additionalProperties": false,
  "description": "GENERATED by `lake exe emitmeta` — do not edit. The trust census: every TypeScript file the effects package ships, in the stratum that holds it. The artifact is committed at library/cas/surface/cas-trust.json; this schema is the Lean declaration of its shape (tools/MetaShapes.lean) and regeneration is byte-identity-gated.",
  "emitted": {
    "emitter": "emitmeta",
    "module": "library/cas/tools/MetaShapes.lean",
    "schemaVersion": 1,
    "toolchain": "4.33.1"
  },
  "properties": {
    "census": {
      "type": "string"
    },
    "convention": {
      "type": "string"
    },
    "counters": {
      "additionalProperties": false,
      "properties": {
        "bare": {
          "minimum": 0,
          "type": "integer"
        },
        "emitted": {
          "minimum": 0,
          "type": "integer"
        },
        "files": {
          "minimum": 0,
          "type": "integer"
        },
        "modelGated": {
          "minimum": 0,
          "type": "integer"
        },
        "tested": {
          "minimum": 0,
          "type": "integer"
        }
      },
      "required": ["files", "emitted", "modelGated", "tested", "bare"],
      "type": "object"
    },
    "emitted": {
      "additionalProperties": false,
      "properties": {
        "emitter": {
          "type": "string"
        },
        "module": {
          "type": "string"
        },
        "schemaVersion": {
          "minimum": 0,
          "type": "integer"
        },
        "toolchain": {
          "type": "string"
        }
      },
      "required": ["schemaVersion", "emitter", "module", "toolchain"],
      "type": "object"
    },
    "excluded": {
      "items": {
        "type": "string"
      },
      "type": "array"
    },
    "files": {
      "items": {
        "additionalProperties": false,
        "properties": {
          "gate": {
            "type": "string"
          },
          "path": {
            "type": "string"
          },
          "stratum": {
            "enum": ["emitted", "model-gated", "tested", "bare"],
            "type": "string"
          }
        },
        "required": ["path", "stratum"],
        "type": "object"
      },
      "type": "array"
    },
    "package": {
      "type": "string"
    },
    "roots": {
      "items": {
        "type": "string"
      },
      "type": "array"
    }
  },
  "required": ["emitted", "census", "package", "roots", "excluded", "convention", "counters", "files"],
  "title": "cas-trust.json",
  "type": "object"
}
